{
  "$schema": "http://json-schema.org/draft-07/schema#",
  "type": [
    "object",
    "null"
  ],
  "properties": {
    "errors": {
      "type": "array",
      "items": {
        "type": "object",
        "properties": {
          "errorLevel": {
            "type": "string"
          },
          "errorReferences": {
            "type": "array",
            "items": {
              "type": "object",
              "properties": {
                "orderId": {
                  "type": [
                    "null",
                    "string"
                  ]
                },
                "topic": {
                  "type": "string"
                },
                "headerId": {
                  "type": "null"
                },
                "orderUpdateId": {
                  "type": "integer"
                }
              }
            }
          },
          "errorType": {
            "type": "string"
          }
        },
        "required": [
          "errorLevel",
          "errorReferences",
          "errorType"
        ]
      }
    },
    "orderId": {
      "type": "string"
    },
    "headerId": {
      "type": "integer"
    },
    "orderUpdateId": {
      "type": "integer"
    },
    "timestamp": {
      "type": "string"
    },
    "batteryState": {
      "type": "object"
    },
    "serialNumber": {
      "type": "string"
    },
    "actionState": {
      "anyOf": [
        {
          "type": "null"
        },
        {
          "type": "object",
          "properties": {
            "command": {
              "type": "string"
            },
            "state": {
              "type": "string"
            },
            "id": {
              "type": "string"
            },
            "timestamp": {
              "type": "string"
            },
            "result": {
              "type": [
                "null",
                "string"
              ]
            }
          },
          "required": [
            "command",
            "id",
            "state",
            "timestamp"
          ]
        }
      ]
    },
    "paused": {
      "type": "boolean"
    },
    "operatingMode": {
      "type": "string"
    },
    "information": {
      "type": "array"
    },
    "actionStates": {
      "type": "array",
      "items": {
        "type": "object",
        "properties": {
          "timestamp": {
            "type": "string"
          },
          "id": {
            "type": "string"
          },
          "metadata": {
            "type": "object",
            "properties": {
              "workpiece": {
                "type": "object",
                "properties": {
                  "workpieceId": {
                    "type": "string"
                  },
                  "history": {
                    "type": "array",
                    "items": {
                      "type": "object",
                      "properties": {
                        "code": {
                          "type": "integer"
                        },
                        "ts": {
                          "type": "integer"
                        }
                      },
                      "required": [
                        "code",
                        "ts"
                      ]
                    }
                  },
                  "type": {
                    "type": "string"
                  },
                  "state": {
                    "type": "string"
                  }
                },
                "required": [
                  "history",
                  "state",
                  "type",
                  "workpieceId"
                ]
              },
              "type": {
                "type": "string"
              }
            }
          },
          "state": {
            "type": "string"
          },
          "command": {
            "type": "string"
          },
          "result": {
            "type": [
              "null",
              "string"
            ]
          },
          "warning": {
            "type": "boolean"
          }
        },
        "required": [
          "command",
          "id",
          "state"
        ]
      }
    }
  },
  "required": [
    "actionState",
    "batteryState",
    "errors",
    "headerId",
    "orderId",
    "orderUpdateId",
    "paused",
    "serialNumber",
    "timestamp"
  ],
  "title": "Module_V1_Ff_Nodered_Serial_State Schema",
  "description": "Granular schema for module_v1_ff_NodeRed_serial_state topics from 170 examples",
  "category": "module",
  "additionalProperties": true
}