{
  "errors": [],
  "orderId": "1aacf6d8-31be-42d5-9adf-162e0b7c768b",
  "headerId": 4,
  "orderUpdateId": 10,
  "timestamp": "2025-10-01T11:38:04.960816Z",
  "batteryState": {},
  "serialNumber": "SVR4H76530",
  "actionState": {
    "command": "CHECK_QUALITY",
    "state": "RUNNING",
    "id": "3ea56977-a1c6-41de-b868-f467388d3a0d",
    "timestamp": "2025-10-01T11:38:04.960533Z"
  },
  "paused": false
}