{
  "headerId": 15,
  "serialNumber": "SVR4H73275",
  "timestamp": "2025-10-01T11:34:14.111157Z",
  "paused": false,
  "batteryState": {},
  "operatingMode": "AUTOMATIC",
  "errors": [],
  "orderUpdateId": 1,
  "information": [],
  "actionState": {
    "id": "0",
    "timestamp": "2025-10-01T11:34:14.109448Z",
    "state": "WAITIING",
    "command": "RGB_NFC"
  },
  "orderId": "0",
  "actionStates": [
    {
      "timestamp": "2025-10-01T11:34:14.109448Z",
      "id": "0",
      "metadata": {
        "type": "RED"
      },
      "state": "WAITIING",
      "command": "RGB_NFC"
    }
  ]
}