{
  "actionStates": [
    {
      "result": "04d78cca341290",
      "id": "0",
      "timestamp": "2025-10-01T11:16:47.602769Z",
      "metadata": {
        "type": "RED"
      },
      "command": "RGB_NFC",
      "state": "FINISHED"
    }
  ],
  "actionState": {
    "result": "04d78cca341290",
    "command": "RGB_NFC",
    "id": "0",
    "timestamp": "2025-10-01T11:16:47.602769Z",
    "state": "FINISHED"
  },
  "batteryState": {},
  "errors": [],
  "orderUpdateId": 1,
  "paused": false,
  "information": [],
  "operatingMode": "AUTOMATIC",
  "serialNumber": "SVR4H73275",
  "timestamp": "2025-10-01T11:16:47.603052Z",
  "headerId": 112,
  "orderId": "0"
}