{
  "actionStates": [
    {
      "state": "RUNNING",
      "command": "PICK",
      "id": "4e1266c1-ee2e-4786-a571-d7c3a1c13c65",
      "timestamp": "2025-10-01T10:03:53.018738Z",
      "metadata": {
        "workpiece": {
          "type": "BLUE",
          "workpieceId": "048989ca341290",
          "state": "PROCESSED",
          "history": [
            {
              "ts": 1759312891595,
              "code": 400
            },
            {
              "ts": 1759312928919,
              "code": 700
            },
            {
              "ts": 1759312971131,
              "code": 600
            },
            {
              "ts": 1759313014494,
              "code": 200
            }
          ]
        }
      }
    }
  ],
  "actionState": {
    "command": "PICK",
    "id": "4e1266c1-ee2e-4786-a571-d7c3a1c13c65",
    "timestamp": "2025-10-01T10:03:53.018738Z",
    "state": "RUNNING"
  },
  "batteryState": {},
  "errors": [],
  "orderUpdateId": 15,
  "paused": false,
  "information": [],
  "operatingMode": "AUTOMATIC",
  "serialNumber": "SVR4H73275",
  "timestamp": "2025-10-01T10:03:53.019055Z",
  "headerId": 61,
  "orderId": "73e83f6f-71b2-4e1c-b665-1e72ab0d3d6f"
}