{
  "actionStates": [
    {
      "state": "RUNNING",
      "command": "RGB_NFC",
      "id": "0",
      "timestamp": "2025-10-01T09:36:06.057906Z",
      "metadata": {
        "type": "BLUE"
      }
    }
  ],
  "actionState": {
    "command": "RGB_NFC",
    "id": "0",
    "timestamp": "2025-10-01T09:36:06.057906Z",
    "state": "RUNNING"
  },
  "batteryState": {},
  "errors": [],
  "orderUpdateId": 1,
  "paused": false,
  "information": [],
  "operatingMode": "AUTOMATIC",
  "serialNumber": "SVR4H73275",
  "timestamp": "2025-10-01T09:36:06.058183Z",
  "headerId": 34,
  "orderId": "0"
}