{
  "actionStates": [
    {
      "state": "WAITIING",
      "command": "PICK",
      "id": "63a451a9-f6d2-4008-869e-0e588469e1f2",
      "timestamp": "2025-10-01T09:40:57.998409Z",
      "metadata": {
        "workpiece": {
          "type": "WHITE",
          "workpieceId": "047b8bca341291",
          "state": "PROCESSED",
          "history": [
            {
              "ts": 1759311560402,
              "code": 400
            },
            {
              "ts": 1759311593910,
              "code": 700
            },
            {
              "ts": 1759311639326,
              "code": 200
            }
          ]
        }
      }
    }
  ],
  "actionState": {
    "command": "PICK",
    "id": "63a451a9-f6d2-4008-869e-0e588469e1f2",
    "timestamp": "2025-10-01T09:40:57.998409Z",
    "state": "WAITIING"
  },
  "batteryState": {},
  "errors": [],
  "orderUpdateId": 11,
  "paused": false,
  "information": [],
  "operatingMode": "AUTOMATIC",
  "serialNumber": "SVR4H73275",
  "timestamp": "2025-10-01T09:40:57.998740Z",
  "headerId": 39,
  "orderId": "d41940cc-356f-4c98-8352-d57c039b9b8e"
}