{
  "actionStates": [
    {
      "result": null,
      "id": "e3986f6b-cd86-475c-a460-7ce0df43e509",
      "timestamp": "2025-10-01T11:14:29.625888Z",
      "metadata": {},
      "command": "INPUT_RGB",
      "state": "FINISHED"
    }
  ],
  "actionState": {
    "result": null,
    "command": "INPUT_RGB",
    "id": "e3986f6b-cd86-475c-a460-7ce0df43e509",
    "timestamp": "2025-10-01T11:14:29.625888Z",
    "state": "FINISHED"
  },
  "batteryState": {},
  "errors": [],
  "orderUpdateId": 1,
  "paused": false,
  "information": [],
  "operatingMode": "AUTOMATIC",
  "serialNumber": "SVR4H73275",
  "timestamp": "2025-10-01T11:14:29.626195Z",
  "headerId": 94,
  "orderId": "e3986f6b-cd86-475c-a460-7ce0df43e509"
}