{
  "actionStates": [
    {
      "command": "factsheetRequest",
      "id": "SOME_ID",
      "state": "FINISHED"
    }
  ],
  "actionState": {
    "command": "factsheetRequest",
    "id": "SOME_ID",
    "timestamp": "2025-10-01T10:46:59.506636Z",
    "state": "FINISHED"
  },
  "batteryState": {},
  "errors": [
    {
      "errorLevel": "WARNING",
      "errorReferences": [
        {
          "orderId": ""
        }
      ],
      "errorType": "RESET_WARNING"
    }
  ],
  "orderUpdateId": 0,
  "paused": false,
  "information": [],
  "operatingMode": "AUTOMATIC",
  "serialNumber": "SVR4H73275",
  "timestamp": "2025-10-01T10:46:59.505886Z",
  "headerId": 88,
  "orderId": ""
}