{
  "errors": [],
  "headerId": 10,
  "orderId": "5acf1a80-07e7-4c80-a128-e6739e681665",
  "timestamp": "2025-10-01T11:23:38.178084Z",
  "orderUpdateId": 10,
  "batteryState": {},
  "serialNumber": "SVR4H76530",
  "actionState": {
    "command": "CHECK_QUALITY",
    "state": "FINISHED",
    "result": "FAILED",
    "timestamp": "2025-10-01T11:23:38.177748Z",
    "id": "3e3b9dd0-906b-4ea3-9a8e-37a8acca0c5d"
  },
  "paused": false
}