{
  "actionStates": [
    {
      "result": "PASSED",
      "id": "1021192a-0dc9-4ee1-9251-48951415354e",
      "timestamp": "2025-10-01T11:20:59.666495Z",
      "metadata": {
        "workpiece": {
          "type": "RED",
          "workpieceId": "040a8dca341291",
          "state": "PROCESSED",
          "history": [
            {
              "ts": 1759317548792,
              "code": 400
            },
            {
              "ts": 1759317578216,
              "code": 600
            },
            {
              "ts": 1759317619102,
              "code": 200
            }
          ]
        }
      },
      "command": "PICK",
      "state": "FINISHED"
    }
  ],
  "actionState": {
    "result": "PASSED",
    "command": "PICK",
    "id": "1021192a-0dc9-4ee1-9251-48951415354e",
    "timestamp": "2025-10-01T11:20:59.666495Z",
    "state": "FINISHED"
  },
  "batteryState": {},
  "errors": [],
  "orderUpdateId": 11,
  "paused": false,
  "information": [],
  "operatingMode": "AUTOMATIC",
  "serialNumber": "SVR4H73275",
  "timestamp": "2025-10-01T11:20:59.666782Z",
  "headerId": 118,
  "orderId": "aa74c367-dfc6-4c3b-b669-af293ea717f1"
}