{
  "headerId": 48,
  "serialNumber": "SVR4H76530",
  "paused": false,
  "actionState": {
    "result": "FAILED",
    "id": "CHECK_QUALITY__1759316235998",
    "timestamp": "2025-10-01T10:57:20.002655Z",
    "command": "CHECK_QUALITY",
    "state": "FINISHED"
  },
  "timestamp": "2025-10-01T10:57:20.003037Z",
  "batteryState": {},
  "orderUpdateId": 7,
  "errors": [],
  "orderId": "CHECK_QUALITY__1759316235997"
}