{
  "headerId": 24,
  "serialNumber": "SVR4H76530",
  "paused": false,
  "actionState": {
    "result": "FAILED",
    "id": "205375e9-ecb6-43b6-a65d-e8a4d9f8df74",
    "timestamp": "2025-10-01T10:14:18.791906Z",
    "command": "CHECK_QUALITY",
    "state": "RUNNING"
  },
  "timestamp": "2025-10-01T10:14:21.953063Z",
  "batteryState": {},
  "orderUpdateId": 10,
  "errors": [],
  "orderId": "0f77cfd1-c4ec-4e5f-8262-d9de2add939a"
}