{
  "actionStates": [],
  "actionState": null,
  "batteryState": {},
  "errors": [
    {
      "errorLevel": "WARNING",
      "errorReferences": [
        {
          "orderId": null
        }
      ],
      "errorType": "RESET_WARNING"
    }
  ],
  "orderUpdateId": 0,
  "paused": false,
  "information": [],
  "operatingMode": "AUTOMATIC",
  "serialNumber": "SVR4H73275",
  "timestamp": "2025-10-01T09:35:06.718066Z",
  "headerId": 28,
  "orderId": ""
}