{
  "headerId": 5,
  "serialNumber": "SVR4H73275",
  "timestamp": "2025-10-01T11:32:28.026854Z",
  "paused": false,
  "batteryState": {},
  "operatingMode": "AUTOMATIC",
  "errors": [],
  "orderUpdateId": 1,
  "information": [],
  "actionState": {
    "result": null,
    "id": "3a17e722-68bc-49c2-b1c6-6d20948d9107",
    "timestamp": "2025-10-01T11:32:28.026572Z",
    "state": "FINISHED",
    "command": "INPUT_RGB"
  },
  "orderId": "3a17e722-68bc-49c2-b1c6-6d20948d9107",
  "actionStates": [
    {
      "metadata": {},
      "timestamp": "2025-10-01T11:32:28.026572Z",
      "command": "INPUT_RGB",
      "result": null,
      "id": "3a17e722-68bc-49c2-b1c6-6d20948d9107",
      "state": "FINISHED"
    }
  ]
}